{"type":"config","name":"SignAndEncrypt Performance","metricName":"ns_per_op","metricUnit":"ns","bestDirection":"lower"}
{"run":8,"commit":"c0a19e1","metric":1678030,"metrics":{"allocs_per_op":1861,"bytes_per_op":1096525},"status":"keep","description":"Reduced PKCS#7 hex placeholder from 16384 to 8192 chars (8192→4096 bytes). Actual signatures use ~1400 bytes, so 4096 is generous. Reduces pdfcpu hex-string parsing time during encryption. 1678030 ns/op (9.0% from baseline). bytes_per_op down 1268462→1096525.","timestamp":1773494297229,"segment":0}
{"run":9,"commit":"3f45055","metric":1554205,"metrics":{"allocs_per_op":1854,"bytes_per_op":1008427},"status":"keep","description":"Further reduced PKCS#7 hex placeholder from 8192 to 4096 chars (4096→2048 bytes). Still 46% headroom above typical RSA-2048 signatures (~1400 bytes). 1554205 ns/op (15.7% from baseline). Massive reduction in pdfcpu hex parsing time.","timestamp":1773494324519,"segment":0}
{"run":13,"commit":"0ba9ea0","metric":1481405,"metrics":{"allocs_per_op":1837,"bytes_per_op":998857},"status":"keep","description":"Pre-computed contentTypeAttr, digestAlgorithm DER, and algorithm identifiers at package init. Eliminates repeated ASN.1 marshaling of constant structures. 1481405 ns/op (19.7% from baseline). Allocs 1853→1837, bytes ~999KB.","timestamp":1773494583196,"segment":0}
{"run":14,"commit":"0917c3c","metric":1477657,"metrics":{"allocs_per_op":1836,"bytes_per_op":997714},"status":"keep","description":"Pre-compute DER-encoded certificate chain at Signer creation time. Eliminates per-call cert bytes concatenation. 1477657 ns/op (19.9% from baseline). allocs 1837→1836, bytes 998857→997714.","timestamp":1773494709866,"segment":0}
{"run":19,"commit":"perf: p","metric":1513850,"metrics":{"allocs_per_op":1710,"bytes_per_op":983249},"status":"discard","description":"Pre-built pdfStringReplacer as package-level var. allocs dropped 1717→1710, bytes 990K→983K. But median ns/op is 1513850 — possibly slightly worse (within noise) compared to 1438511. The allocation improvement is real but ns/op effect is unclear with system variance.","timestamp":1773495067096,"segment":0}
{"run":20,"commit":"82a572a","metric":1459565,"metrics":{"allocs_per_op":1710,"bytes_per_op":983311},"status":"keep","description":"Pre-built pdfStringReplacer as package-level var instead of creating per call. Saves ~7 allocs/op and ~7KB/op. 1459565 ns/op (20.9% from baseline). allocs 1717→1710.","timestamp":1773495090914,"segment":0}
{"run":21,"commit":"2e18002","metric":1426469,"metrics":{"allocs_per_op":1710,"bytes_per_op":982680},"status":"keep","description":"Encode PKCS#7 hex directly into result buffer's Contents region instead of using intermediate hexBufPool. Eliminates pool get/put and one memcpy. 1426469 ns/op (22.7% from baseline).","timestamp":1773495154348,"segment":0}
{"run":22,"commit":"839350b","metric":1445673,"metrics":{"allocs_per_op":1710,"bytes_per_op":982679},"status":"keep","description":"Same direct hex encoding optimization applied to SignStream path. Doesn't affect SignAndEncrypt benchmark (uses SignBytes) but improves SignStream. 1445673 ns/op (within noise of 1426469). Code consistency improvement.","timestamp":1773495189408,"segment":0}
{"run":23,"commit":"3fcc16c","metric":1454403,"metrics":{"allocs_per_op":1710,"bytes_per_op":982861},"status":"keep","description":"Removed unused hexBufPool (no longer needed since hex encoding is done directly in target buffers). 1454403 ns/op (within noise). Code cleanup.","timestamp":1773495218593,"segment":0}
{"run":24,"commit":"c5d8e7a","metric":1422748,"metrics":{"allocs_per_op":1710,"bytes_per_op":982826},"status":"keep","description":"Replaced hex.Encode + lowercase-to-uppercase loop with custom encodeUpperHex that produces uppercase directly. Removes encoding/hex import. 1422748 ns/op (22.9% from baseline).","timestamp":1773495299487,"segment":0}
{"run":25,"commit":"bc8cc41","metric":1437694,"metrics":{"allocs_per_op":1706,"bytes_per_op":982708},"status":"keep","description":"Replaced fmt.Sprintf ByteRange formatting with custom formatByteRange that writes directly into buffer. Eliminates string allocation. allocs 1710→1706. 1437694 ns/op (22.1% from baseline).","timestamp":1773495366838,"segment":0}
{"run":26,"commit":"234e676","metric":1421465,"metrics":{"allocs_per_op":1706,"bytes_per_op":982798},"status":"keep","description":"Added rsaKey.Precompute() in NewSigner to ensure CRT values are computed for faster RSA signing. 1421465 ns/op (22.9% from baseline). Likely already precomputed by pkcs12.Decode but ensures it for all code paths.","timestamp":1773495429538,"segment":0}
{"run":27,"commit":"confirm","metric":1421904,"metrics":{"allocs_per_op":1706,"bytes_per_op":982722},"status":"discard","description":"Confirmation run — no code changes. Stable at 1421904 ns/op, confirming ~23% improvement from baseline.","timestamp":1773495523307,"segment":0}
